{
  "schema_version": 2,
  "started_at": "2026-07-15T11:56:44.165Z",
  "finished_at": "2026-07-15T12:02:26.817Z",
  "environment": {
    "executor_profile": "node",
    "container_image_ref": "node@sha256:5647be709086c696ff32edaaf1c70cd26d1da6ab2b39c32f3c7b4c4a31957e37",
    "container_image_digest": "node@sha256:5647be709086c696ff32edaaf1c70cd26d1da6ab2b39c32f3c7b4c4a31957e37",
    "container_image_id": "sha256:466e07e7ea13241d68674fadda868d14d923336eb2f4fa0022be0d866230d8b4",
    "container_os": "linux",
    "container_architecture": "arm64",
    "network_policy": "phaseA:bridge,phaseB:none",
    "source_commit": "487ab430e17b0aa2868b33b9667c1676e6efd3be",
    "base_tree_digest": "sha256:a4263a0915832f9dd2df2e4913caf9018731e972900d787bcec5585e569766eb",
    "pre_check_tree_digest": "sha256:15f8faa106d8bbce4b5e75737014326ed251d8a2a08049322103fe94172f5a6d",
    "approved_tracked_tree_digest": "sha256:f99f85bb72a532b9543517f823d53545f288c275d7b1ee494b85b27581f72ed8",
    "post_check_tree_digest": "sha256:cfa59d65f49524848af50f609d4d68cb3bd41f3c05670ff6aec70434212eb38a",
    "check_tree_changed": true,
    "patch_sha256": "sha256:4a1d0e072bc383e95a7307d2955d2d8e6215e7fe73e7c28fee67c845e40a1352",
    "install_commands": [
      "mkdir -p /workspace/.northset/bootstrap-home/bin /workspace/.northset/bootstrap-home/go",
      "cp /usr/local/bin/node /workspace/.northset/bootstrap-home/bin/node",
      "curl -fsSL https://go.dev/dl/go1.26.5.linux-arm64.tar.gz | tar -xz --strip-components=1 -C /workspace/.northset/bootstrap-home/go",
      "npm install --global --prefix /workspace/.northset/bootstrap-home --no-audit --no-fund pnpm@10.33.2",
      "mkdir -p /workspace/.northset/bootstrap-home/linter-go-tmp",
      "PATH=/workspace/.northset/bootstrap-home/bin:/workspace/.northset/bootstrap-home/go/bin:$PATH GOBIN=/workspace/.northset/bootstrap-home/bin GOMODCACHE=/workspace/.northset/bootstrap-home/linter-go-mod GOCACHE=/workspace/.northset/bootstrap-home/linter-go-build GOTMPDIR=/workspace/.northset/bootstrap-home/linter-go-tmp /workspace/.northset/bootstrap-home/go/bin/go install github.com/golangci/golangci-lint/v2/cmd/golangci-lint@v2.7.2",
      "test -x /workspace/.northset/bootstrap-home/bin/golangci-lint",
      "rm -r /workspace/.northset/bootstrap-home/linter-go-mod /workspace/.northset/bootstrap-home/linter-go-build /workspace/.northset/bootstrap-home/linter-go-tmp",
      "PATH=/workspace/.northset/bootstrap-home/bin:/workspace/.northset/bootstrap-home/go/bin:$PATH GOMODCACHE=/workspace/.northset/bootstrap-home/project-go-mod go mod download",
      "PATH=/workspace/.northset/bootstrap-home/bin:$PATH pnpm --dir ui install --frozen-lockfile"
    ]
  },
  "commands": [
    {
      "cmd": "PATH=/workspace/.northset/bootstrap-home/bin:/workspace/.northset/bootstrap-home/go/bin:$PATH pnpm --dir ui exec vitest run src/composables/charts/shared/chartConfig.test.ts",
      "exit_code": 0,
      "duration_ms": 5028
    },
    {
      "cmd": "PATH=/workspace/.northset/bootstrap-home/bin:/workspace/.northset/bootstrap-home/go/bin:$PATH pnpm --dir ui typecheck",
      "exit_code": 0,
      "duration_ms": 19475
    },
    {
      "cmd": "PATH=/workspace/.northset/bootstrap-home/bin:/workspace/.northset/bootstrap-home/go/bin:$PATH pnpm --dir ui format:check",
      "exit_code": 0,
      "duration_ms": 9184
    },
    {
      "cmd": "PATH=/workspace/.northset/bootstrap-home/bin:/workspace/.northset/bootstrap-home/go/bin:$PATH pnpm --dir ui test",
      "exit_code": 0,
      "duration_ms": 8022
    },
    {
      "cmd": "EMBED_UI=True PATH=/workspace/.northset/bootstrap-home/bin:/workspace/.northset/bootstrap-home/go/bin:$PATH pnpm --dir ui build",
      "exit_code": 0,
      "duration_ms": 15258
    },
    {
      "cmd": "PATH=/workspace/.northset/bootstrap-home/bin:/workspace/.northset/bootstrap-home/go/bin:$PATH GOMODCACHE=/workspace/.northset/bootstrap-home/project-go-mod go test -count=1 ./...",
      "exit_code": 0,
      "duration_ms": 28993
    },
    {
      "cmd": "PATH=/workspace/.northset/bootstrap-home/bin:/workspace/.northset/bootstrap-home/go/bin:$PATH GOMODCACHE=/workspace/.northset/bootstrap-home/project-go-mod golangci-lint run",
      "exit_code": 0,
      "duration_ms": 14745
    }
  ],
  "usage": {
    "networked_setup_elapsed_ms": 190939,
    "dependency_install_ms": null,
    "declared_commands_ms": 100705,
    "cpu_ms": null,
    "peak_rss_bytes": null
  },
  "notes": null,
  "redactions": {}
}
