{
  "schema_version": 2,
  "started_at": "2026-07-16T19:21:16.236Z",
  "finished_at": "2026-07-16T19:21:29.635Z",
  "environment": {
    "executor_profile": "node",
    "container_image_ref": "node@sha256:40ad9f3064e67d6860b4bc3fe1880b2953934fd6320ada990e45fe0efa6badd7",
    "container_image_digest": "node@sha256:40ad9f3064e67d6860b4bc3fe1880b2953934fd6320ada990e45fe0efa6badd7",
    "container_image_id": "sha256:6ed6ff875e9714bb845b850b08f3ad231ccbb5848812647bcf11acdd4bd1d2f8",
    "container_os": "linux",
    "container_architecture": "arm64",
    "network_policy": "phaseA:bridge,phaseB:none",
    "source_commit": "bf5a048af748e2ff896142f615373bffaf1d9895",
    "base_tree_digest": "sha256:995ce2d5da6368efc9a4dc414b2a2d2d9d6fad41df6ac5393b92735f42c298a9",
    "pre_check_tree_digest": "sha256:c9f98baa596e8bb86d6137980d7fd8a0b0c6b3f2c04435dc9edad5c97281d05e",
    "approved_tracked_tree_digest": "sha256:a1ae560b86f8a1977669c019042b032e8f1c8ff9a80759e34b28f06a706327c5",
    "post_check_tree_digest": "sha256:c9f98baa596e8bb86d6137980d7fd8a0b0c6b3f2c04435dc9edad5c97281d05e",
    "check_tree_changed": false,
    "patch_sha256": "sha256:9d9f74ad30819770382b88e1cd02db1ea9e4192dd003f80e7b2e5f3c009209a8",
    "install_commands": [
      "npm ci"
    ]
  },
  "commands": [
    {
      "cmd": "node --test src/errors.terminal-cleanup.test.js",
      "exit_code": 0,
      "duration_ms": 936
    }
  ],
  "usage": {
    "networked_setup_elapsed_ms": 9027,
    "dependency_install_ms": null,
    "declared_commands_ms": 936,
    "cpu_ms": null,
    "peak_rss_bytes": null
  },
  "notes": null,
  "redactions": {}
}
