{
  "started_at": "2026-07-14T16:37:19.594Z",
  "finished_at": "2026-07-14T17:20:53.053Z",
  "environment": {
    "executor_profile": "node",
    "container_image_ref": "node@sha256:40ad9f3064e67d6860b4bc3fe1880b2953934fd6320ada990e45fe0efa6badd7",
    "container_image_digest": "node@sha256:40ad9f3064e67d6860b4bc3fe1880b2953934fd6320ada990e45fe0efa6badd7",
    "network_policy": "phaseA:bridge,phaseB:none",
    "source_commit": "b419d921c8de0b68e7eb7054f412b05ee69336a2",
    "base_tree_digest": "sha256:0b6c2f29bf596086b82e6b2913c49484fd42c43e91ffcfe66adc39ca59a2d285",
    "pre_check_tree_digest": "sha256:5ee54bb4584ab3e199557bd420bf60ffe974413b84033bbfb175dda69e7502ff",
    "approved_tracked_tree_digest": "sha256:ff468613ccf1e1f660674149d694e500c29e04831578bf75fbf9f9d4b5604cf2",
    "post_check_tree_digest": "sha256:fdb76ac01e2c03057bcbb5019cd46a37ff88991efb8d3601182b41ecf8f1db41",
    "check_tree_changed": true,
    "patch_sha256": "sha256:9e8ee6fcbffe89b16cdec6f8a08f6f5c47ea0bd4a724f1cc52baa62e0e4a4f30",
    "install_commands": [
      "corepack yarn install --immutable"
    ]
  },
  "commands": [
    {
      "cmd": "corepack yarn workspace @kaoto/kaoto test src/components/Visualization/Canvas/Canvas.test.tsx packages/ui/src/components/Visualization/Canvas/Canvas.test.tsx --configLoader runner",
      "exit_code": 0,
      "duration_ms": 24747
    },
    {
      "cmd": "corepack yarn workspace @kaoto/kaoto lint",
      "exit_code": 0,
      "duration_ms": 103713
    },
    {
      "cmd": "corepack yarn workspace @kaoto/kaoto lint:style",
      "exit_code": 0,
      "duration_ms": 9291
    },
    {
      "cmd": "corepack yarn workspace @kaoto/kaoto test --configLoader runner --maxWorkers 2",
      "exit_code": 0,
      "duration_ms": 2031105
    }
  ],
  "notes": null,
  "redactions": {
    "email": 66,
    "jwt": 104
  }
}
