{
  "schema_version": 2,
  "started_at": "2026-07-16T22:03:06.501Z",
  "finished_at": "2026-07-16T22:03:58.762Z",
  "environment": {
    "executor_profile": "node",
    "container_image_ref": "node@sha256:40ad9f3064e67d6860b4bc3fe1880b2953934fd6320ada990e45fe0efa6badd7",
    "container_image_digest": "node@sha256:40ad9f3064e67d6860b4bc3fe1880b2953934fd6320ada990e45fe0efa6badd7",
    "container_image_id": "sha256:6ed6ff875e9714bb845b850b08f3ad231ccbb5848812647bcf11acdd4bd1d2f8",
    "container_os": "linux",
    "container_architecture": "arm64",
    "network_policy": "phaseA:bridge,phaseB:none",
    "source_commit": "471a5a12ccc364c68196fc13f2c1fc3c3ce375ea",
    "base_tree_digest": "sha256:351d07d50a3963d74eb65ffb79734eea2bfaa14edb08e53d4f6ce7bd5f9d3fcb",
    "pre_check_tree_digest": "sha256:0e3e1c5f366a6fb70e8127ca853f1ce0d5d4d8bb8fb1b9715febadeea8eaee3f",
    "approved_tracked_tree_digest": "sha256:9b5e1ccc6159c222b4e953ac11d1425e5adf76e0d10f77217757b32b6312d299",
    "post_check_tree_digest": "sha256:c5ed37791d27fb21526e6c97e6adb59599bd104f6dc7da831ddce82d22aab719",
    "check_tree_changed": true,
    "patch_sha256": "sha256:6f531965f335cd27e987e7bb253da2fee90687665dfcc057ddd8dcbd2361ade8",
    "install_commands": [
      "npm install --ignore-scripts --no-package-lock --legacy-peer-deps"
    ]
  },
  "commands": [
    {
      "cmd": "ln -s \"$PWD/node_modules\" /tmp/node_modules && cp vitest.config.ts /tmp/vitest.config.ts && npm test -- --config /tmp/vitest.config.ts --root \"$PWD\" --no-cache tests/loader.test.ts",
      "exit_code": 0,
      "duration_ms": 3100
    }
  ],
  "usage": {
    "networked_setup_elapsed_ms": 39933,
    "dependency_install_ms": null,
    "declared_commands_ms": 3100,
    "cpu_ms": null,
    "peak_rss_bytes": null
  },
  "notes": null,
  "redactions": {}
}
