{
  "started_at": "2026-07-14T00:54:12.419Z",
  "finished_at": "2026-07-14T01:25:30.968Z",
  "environment": {
    "executor_profile": "node",
    "container_image_ref": "node@sha256:40ad9f3064e67d6860b4bc3fe1880b2953934fd6320ada990e45fe0efa6badd7",
    "container_image_digest": "node@sha256:40ad9f3064e67d6860b4bc3fe1880b2953934fd6320ada990e45fe0efa6badd7",
    "network_policy": "phaseA:bridge,phaseB:none",
    "source_commit": "caf30cc7c6123728c8c05d1f36e9cd8a67f23f0e",
    "base_tree_digest": "sha256:5b5b2958b2199c0a2ef17dfebd7cf1118b8732305c99959d9014f83426786617",
    "pre_check_tree_digest": "sha256:09c6209c8241fa640199eab9016d69d3872cb3aec613945c0221660c66f5f7d4",
    "approved_tracked_tree_digest": "sha256:aa7d6c1cf8a7adb232b5848219f306595245dc5fe130f85eebd577d00912a6ec",
    "post_check_tree_digest": "sha256:8a1de4bc372406394f16499c277c5bfe04b2c526648ab20709cdac32c2320ce4",
    "check_tree_changed": true,
    "patch_sha256": "sha256:df4e811a58411b60c9f1b8362e342138080730992f78ff08c7e60ae0bf61d025",
    "install_commands": [
      "corepack yarn install --immutable"
    ]
  },
  "commands": [
    {
      "cmd": "corepack yarn workspace @kaoto/kaoto test src/services/document/xml-schema/xml-schema-document.service.abstract-repeated-ref.test.ts packages/ui/src/services/document/xml-schema/xml-schema-document.service.abstract-repeated-ref.test.ts --configLoader runner",
      "exit_code": 0,
      "duration_ms": 18973
    },
    {
      "cmd": "corepack yarn workspace @kaoto/kaoto lint",
      "exit_code": 0,
      "duration_ms": 69918
    },
    {
      "cmd": "corepack yarn workspace @kaoto/kaoto lint:style",
      "exit_code": 0,
      "duration_ms": 7887
    },
    {
      "cmd": "corepack yarn workspace @kaoto/kaoto test --configLoader runner --maxWorkers 4",
      "exit_code": 0,
      "duration_ms": 1431368
    }
  ],
  "notes": null,
  "redactions": {
    "email": 32,
    "jwt": 104
  }
}
